{
  "schema_version": 2,
  "t": 1791806400000,
  "demo": false,
  "agents": [
    {
      "id": "3836a0f1fbc145b31b1dd951b0c1a235",
      "tool": "gemini",
      "host": "cli",
      "ordinal": 1,
      "parent": null,
      "root_id": "5c96dbc2661405adf9ab0e86e0eef50b",
      "account_id": "2f7339c66415277e5b58670b67b979a9",
      "session_id": "9bba8798fac4cb0ddf1648c68bd3afb2",
      "turn_id": "b601e355567c25eb5cbb699b1b117ba2",
      "request_id": null,
      "state": "working",
      "confidence": "exact",
      "since": 1791806280000,
      "started_at": 1791802800000
    }
  ],
  "tools": [
    {
      "tool": "gemini",
      "root_id": "deb46da1e3defa95acbafd381ccb6a20",
      "presence": "present",
      "hooks": "missing",
      "coverage": "degraded",
      "coverage_reason": "hooks_missing"
    }
  ],
  "limits": [],
  "attention": {
    "needs_you": 0,
    "oldest_since": null
  }
}
